{
  "acceptable_conclusions": [
    "The synthetic aws identity escalated privileges and created persistence."
  ],
  "episode_id": "aws-iam-002",
  "expected_attack_path": [
    "evt-0004",
    "evt-0005",
    "evt-0006"
  ],
  "expected_attack_techniques": [
    "T1078",
    "T1098"
  ],
  "malicious_entity_ids": [
    "suspected-identity",
    "aws:resource:admin"
  ],
  "malicious_event_ids": [
    "evt-0004",
    "evt-0005",
    "evt-0006"
  ],
  "minimum_evidence_items": 1,
  "schema_version": "0.3"
}
